{
  "$schema": "https://json-schema.org/draft/2020-12/schema",
  "$id": "GenerateFlashcardsResponse.json",
  "title": "GenerateFlashcardsResponse",
  "type": "array",
  "minItems": 1,
  "items": {
    "type": "object",
    "additionalProperties": false,
    "required": ["id", "courseId", "topicId", "prompt", "answer"],
    "properties": {
      "id": {"type": "string", "minLength": 1},
      "courseId": {"type": "string", "minLength": 1},
      "topicId": {"type": "string", "minLength": 1},
      "prompt": {"type": "string", "minLength": 1},
      "answer": {"type": "string", "minLength": 1},
      "citations": {
        "type": "array",
        "items": {"type": "string", "minLength": 1}
      }
    }
  }
}
